{
  "event_type": "security_finding",
  "tool": "NetworkSecurityAuditor",
  "tool_version": "5.4.0",
  "timestamp": "2026-07-08T00:00:00Z",
  "host": "HOST01",
  "os": "Windows 11 Enterprise",
  "domain": "EXAMPLE.LOCAL",
  "scan_profile": "Full",
  "overall_score": 85,
  "overall_grade": "B",
  "check_id": "EP01",
  "category": "Endpoint Security",
  "label": "Defender / EDR Deployment + ASR Rules",
  "severity": "Critical",
  "status": "Pass",
  "findings": "Protection is enabled.",
  "findings_truncated": false,
  "evidence": "Synthetic evidence.",
  "evidence_truncated": false,
  "cis": "10.1",
  "nist": "3.14.1",
  "mitre_tactics": ["TA0112"],
  "mitre_techniques": ["T1685"],
  "duration_ms": 12.3
}
